cat,i de la a que el l un d una en no del per els les amb se però tot s era li com al es és cap més seva havia hi fou això ell després perquè n si son noi sid aquell tan damunt digué escola senyor quan tota 
fra,de la il à et un le en je les l d mon du une des est a que s ne ce qui pas oncle n dans au mais m c qu son ces me se j e t ses pour professeur avec était sur cela y cette bien plus 
glg,que o d a os de e n as non é pra á se en nos por y unha un como pol alcalde si ¿qué hay porque mais sacretario c ôs ten qué nin dios son ô cando lle sin â labrego ¿cal qu fan s con cousa ¿por boca 
ita,e la di che le un si il in a non una era i sua del gegia ma della per aveva ella con da l è alla come lotte più d finestra suo delle ad nella dei calle al lei poi ci s quando così ch cui palazzo ogni se 
por,de a e que o d da se um uma os não em do luiza lhe por com dos na as n era para das no sua ella mais ao á como é me ruy já marquez senhora seus mas nos menina elle ezequiel olhos aos seu essa pela nas 
ron,de si in a la o cu se ca din un ce pe al i care sa lui este nu n eminescu prin mi sau mai cand e ti cum am as ale l sunt dulce s te viata intr pentru fi il ii fata mea poetul el ei iar 
spa,de la y que el en a los no se las por un con del su como una al más lo es era sus para le pero o si celedonio sin bismarck pues tan había obra entre nos cuando arte esta don ni este vida él magistral todo vetusta fermín 
