ara,من في الى على كان التي أن الذي هارت عن ما أو ذلك المشروع هو عام غير الكتب الكتاب العالم كما نفسه هذا وهو مع مشروع يكن النشر لم خلال غوتنبرغ تلك الالكتروني كل حتى لقد مجاناً لا مثل الملكية مكتبة رقمية بين أجل العديد قدر دون الأمر منها بأنه به منه وكان آخر لكن أي الفكرية الناس الذين مايكل ومن موقع أحد العام الالكترونية يتيح الا فإن ولهذا بعد جامعة هناك بعض ثم مجال اسم عدد كانت النص قد فقد بها كتاب عليه الآن يقوم ألف شبكة يفعل الخ نسخة الرجل العظيم أخرى فيها وصف كتاب، المنزلية الوقت الإنسانية 
cmn,。 　　 ！ 的。 会。 道。 ： 　 与伯特利布道团合作的三年 第一章 妹。） ， 第四章 下。 力。 从出生到赴美留学之前 的工作。 见证。 领会。 的 去。 悔改。 ） keng 利未年月日 息。 　　十一月一日见证会中，七个哑人能说话，一个印度人耳聋能听见了， 有睡觉。两位接生妇科医生同心祷告，求主在五天开会期间，没有人找她 为此作见证。有一位永春姊妹，患肺结核，多年吐血，第一晚听道后有疑 们接生，便于赴会听道。神果然垂听她们的祷告。饥渴慕义之心何等感人 滕 　　有几个护士，夜间在吉隆坡医院值夜班，白天到巴生来听道，五天没 未归还，次日清晨还林弟兄，心中方安。 经芙蓉，有一条毛巾是从未用过的，要抽税五毛钱，林海东弟兄代纳，尚 　　十月二十七日赴巴生，是夜不能安睡。因从麻坡坐汽车往吉隆坡，路 愈觉奇妙，一直涌到永生。心中便有了力量。） 布道会所唱的短歌：罪恶出去，活水进来，藉着丰满恩典；活水愈涌， 这个布道所才暂停工作。每当罪恶思想侵扰我的时候，一唱当年宋博士在 小姐在吉隆坡附近的暗邦小埠上成立了一个布道所，直到后来日本南进， 的宋博士恳切祷告下得了完全的医治。当时几十人献身为主工作。有一位 多老信徒们都为罪而流下热泪，许多为人所不能治的病，在圣灵能力充满 会中，宋博士穿着白长衫，一双旧皮鞋，头发没有梳上而垂在前额上。许 过一篇短文宋尚节博士在吉隆坡。在吉隆坡八打灵山上卫理公会布道 　　（附：彭芬姊妹在一九六○年新加坡基督徒布道团银禧纪念刊上，写 心，第二晚回家后，耳中仍听见我的讲道声，忽想起自己的罪，第三个晚 ，将两个古董私归自己，每见之，心中难过。在怀仁作校长时，按规矩作 上听见一个声音叫她为主作工，现在病好了，问我当如何为主作工？我告 不落空。 全国布道的工作，要先以伯特利布道团为助臂。要完成这次南洋布道工作 ，以厦门查经会为助臂。神每要我完成一步重要的工作，必先安排天使保 守一切。虽有敌人反对，神有力量慑服之，等完成工作后，这些天使又移 他处。 　　吴静聆提及新加坡牧师反对用基督徒布道团六个字，只肯用基 督教布道团六个字。我说：一切组织都要归于虚空，但神所建立的永 　　十一月二日到达仰光，四、五十人来接，我与他们一起唱十字架， 后能感动许多人流泪，为病人祷告，都不是一天得到的，乃是神逐步启示 十字架，永是我的荣耀。劝他们多祷告，准备好圣经，领人来听道。当 晚仰光报纸已经刊登我与欢迎者的合影。沿途看见许多人穿黄袍，因为每 个缅甸人需要有一个时期作和尚。与弟兄姊妹赴观大金塔，真是伟观。许 多国家的人来献金银珠宝，在大金塔内珍藏之，塔顶有大金钢钻。巨富林 振言家五层楼，内有各种奇异珍宝。但是属世一切的建筑，都要归于虚空 ；属灵的建筑，永不落空。 来的。有许多人效法，但没有负架的经验为后盾，不免跌倒。神要我完成 　　十一月八日那天，我对吴静聆姊妹谈到我写日记、查经的方法，唱诗 诉她为主作工的方法。 　　十一月三日到达槟城，槟城正筹建新堂，怕我去了影响捐款成绩。其 　　十一月二日离开巴生赴槟城途中，吴静聆姊妹述说她个人蒙恩经过。 她看我的讲道集中提及耶稣说：……若有一文钱没有还清，你断不能从 那里出来。（参阅太５：２６）圣灵大工作，她想到在新街教幼稚园时 教职员六年，可将校内代备之棉被收为己有，她曾将一棉被较早收为己有 ，心中不安，难以入眠。赔偿后，心中方安。圣灵能将人已忘记的罪想起 来，真奇妙也。 实信徒若复兴起来，热心爱主，自必更加乐意奉献。信徒找牧师商量利用 字架跟随，想到这里不禁泪下，愈想到神的特恩，愈自觉惭愧。 我赴仰光等船的时间讲一次道，故在圣公会向四百多人讲底马，会后 有四十七名新得救的，我请一百多软弱跌倒者留下。宋培荣带其子来，他 由于经商，产业全失，逃身南洋，经商又失败，身体不好，真是可怜。我 劝他看破世界，非彻底看破世界，否则不肯完全奉献。 　　由槟城赴仰光途中，我想到自己有许许多多地方不如其他复兴家，如 口才、面貌、人情世故、文章、音乐等等，但蒙神如此特爱，拣选我背十 主得胜。 妇详细查问表示怀疑，但是一百多位病人亲自见证他们的病，实在已蒙主 的工作。想到自己也有许多失败之点，只有再次儆醒祷告，洁净自己，靠 己无罪，便是自欺，真理不在我们心里了。向他谈强盗得救故事，由于 讲道时，我与他并听众都受感一起落泪。当时虽有马戏团的打鼓声，小孩 务几乎还清，心中平安，会督让他再到教会来工作。在讲找亡羊这篇 务累身。失眠一个月，几乎要发疯，几个女儿安慰他，再作生意，现在债 教堂外，一切烧尽。由于贪心，又借一万元建一新店，忽然胶泥跌价，债 资十五元，不够用，不得不作生意十几年，赚五、六万元。因为失火，除 　　为我作传译的黄世馨牧师告诉我，三十多年前他到这里传道，每月工 真蒙恩了。 夜，一看圣经，甚是明了；如不起来，则心中难过不安。到堂一听道，果 上睡觉时，有声音催他去礼拜堂听道，叫他读马太福音第八章。他一连三 　　李仲明本不信道，从未读过圣经，也不识字。一九三六年十月九日晚 ，鬼去矣！ 　　有黄兰锑者，有鬼总在他耳旁说话，帮他认罪后，为他按手祷告赶鬼 他好了，许多人要信主。 是安静，鬼出去了。我与他一起读圣经约翰壹书一章八节：我们若说自 　　当地的居民以割胶为生，必须早睡早起，若非真正渴慕，难以前来赴 来，人又发疯，甚至要投江自杀，兴化巴区长带他来找我。一见到我，甚 
deu,der die und das den ein dem ist auf in er so hat zachenhesselhans sich im mit sie wie zu ich einer noch an da aber nicht nit einen aus auch über eine wenn von wir fei hanstonl vom denn sagt es jetzt daß schon was fanele haben sein sind um wieder am du helari weil wald ihm wird einmal is muß kann wawrl geht hab mir als des peterl nur für zum wind s zwei doch ihr franzl durch viel schnee hans alte vor einem nach nun gar sonnenwirbel waldland kein immer mehr oder kommt will unter denkt dann 
eng,the and of to a i he in that was his it had you with as at which for my is have him be there on this me said upon but from we all they not no her were by one so been them when are man up an would out what who or some if into could down will their holmes she over your do then more little has now before very two about time other come any way face came asked our how see through answered eyes well hand than however found should hope ferrier us these long 
fra,de la à et le les je un en nous des du il que ne une mon pas dans se ce au me qui oncle plus mais sur par cette ces avec pour a son dun sa est ses bien si professeur sans tout comme hans dune peu ma mes notre était donc deux sous elle lui dont où nos avait non cest encore ou on heures fut mer cela fait même y moi quil là cependant tu pendant pieds quelques aux tête rien oui après terre alors leur ainsi ni être cet car quand quelque puis dit radeau axel 
por,de a e que o da os do em um as uma com não se por na dos no das para como á ao mais era sua é sem ella eu mas lhe nos ou elle já nas seu seus aos luiza toda pela num numa tudo dum grande tinha sobre casa me entre pelo quando olhos rogério então onde ás tão foi mesmo annos velho muito vida todos ia nem ainda noite suas duma meu tempo quem essa pouco cada disse minha tinham vez até mulher bem quasi estava ter depois dia cabeça mãos esse voz dois duas homem 
spa,de la que y el en a se los no un las su con del por era una lo había le más como al pero don para sus él es sin si ella todo vetusta o muy estaba ni aquella doña ya aquel ana tenía ser poco esta porque cuando magistral todos sobre podía eran siempre mucho menos ojos este habían entre bien señor yo tan vez hasta sí regenta después decía allí esto mesía casa otro anita nada dos sabía aquellos ozores así quería hombre algo qué tal mujer eso años iba antes mundo todas usted aunque pues también 
