ara,من في الى على كان التي أن الذي هارت عن ما أو ذلك المشروع هو عام غير الكتب الكتاب العالم كما نفسه هذا وهو مع مشروع يكن النشر لم خلال غوتنبرغ تلك الالكتروني كل حتى لقد مجاناً لا مثل الملكية مكتبة رقمية بين أجل العديد قدر دون الأمر منها بأنه به منه وكان آخر لكن أي الفكرية الناس الذين مايكل ومن موقع أحد العام الالكترونية يتيح الا فإن ولهذا بعد جامعة هناك بعض ثم مجال اسم عدد كانت النص قد فقد بها كتاب عليه الآن يقوم ألف شبكة يفعل الخ نسخة الرجل العظيم أخرى فيها وصف كتاب، المنزلية الوقت الإنسانية 
cmn,。 the of to and his chinese 　　 in he a ！ is 的。 singapore 会。 were any where people one at 　 sung through 　　drsung ： drsung into 道。 on 的工作。 yesterday that who john keng thousands arrived has converts farewell wharf 第一章 悔改。 从出生到赴美留学之前 about 去。 利未年月日 sermon night ） streets my by scoffers 力。 home 第四章 的 way 妹。） with 息。 worked preacher from for 见证。 not 下。 whole 与伯特利布道团合作的三年 preaching ， as 领会。 子的吵闹声，但这些都不能拦阻圣灵的工作。 讲道时，我与他并听众都受感一起落泪。当时虽有马戏团的打鼓声，小孩 真蒙恩了。 　　林弟兄向我诉苦，他妻子从早到晚读经祷告，置丈夫、女儿不理。多 务几乎还清，心中平安，会督让他再到教会来工作。在讲找亡羊这篇 　　为我作传译的黄世馨牧师告诉我，三十多年前他到这里传道，每月工 出姊妹的错误，劝她悔改。她认识自己错了，向丈夫认错。我为他们祷告 少人劝她徒劳，他对妻已绝望。我请求他可否给我一次机会，使他们夫妻 后，我将别人送吴静聆姊妹的花转送给他们，祝愿他们如一对新婚夫妇和 务累身。失眠一个月，几乎要发疯，几个女儿安慰他，再作生意，现在债 　　当地的居民以割胶为生，必须早睡早起，若非真正渴慕，难以前来赴 资十五元，不够用，不得不作生意十几年，赚五、六万元。因为失火，除 能和睦如初。那天会毕，请他们夫妇到楼上，根据哥林多前书第七章，指 教堂外，一切烧尽。由于贪心，又借一万元建一新店，忽然胶泥跌价，债 坡听道后，回诗诬后大有信心，满有医病祷告的恩赐，说我扰乱、分裂 十年者说，善恶都可以尝试，以增经验，这是错误的，毒药岂可试服呢？ 纸转载福州报纸诋毁我的内容。 得的经节是……对那家的主人说，夫子说，客房在哪里？我与门徒好在 　　有一位杜弟兄，一大早来找我说：我家的车夫在赴会后，为自己的 那里吃愈越节的筵席。（可１４：１４）我问父亲：我在世寿数几何 ？父亲说：１９５０年，你便要与我同在。父亲抱着我，甚是喜乐 。我问父亲：可否祷告求主将我在世时间延长？父亲说：不能延长 。我想我只能在世１４年，真是短促。经过祷告，神示昨夜梦兆不是真 
deu,der die und das den ein dem ist auf in er so hat zachenhesselhans sich im mit sie wie zu ich einer noch an da aber nicht nit einen aus auch über eine wenn von wir fei hanstonl vom denn sagt es jetzt daß schon was fanele haben sein sind um wieder am du helari weil wald ihm wird einmal is muß kann wawrl geht hab mir als des peterl nur für zum wind s zwei doch ihr franzl durch viel schnee hans alte vor einem nach nun gar sonnenwirbel waldland kein immer mehr oder kommt will unter denkt dann 
eng,the and of to a i he in that was his it had you with as at which for my is have him be there on this me said upon but from we all they not no her were by one so been them when are man up an would out what who or some if into could down will their holmes she over your do then more little has now before very two about time other come any way face came asked our how see through answered eyes well hand than however found should hope ferrier us these long 
fra,de la à et le les je un en nous des du il que ne une mon pas dans se ce au me qui oncle plus mais sur par cette ces avec pour a son dun sa est ses bien si professeur sans tout comme hans dune peu ma mes notre était donc deux sous elle lui dont où nos avait non cest encore ou on heures fut mer cela fait même y moi quil là cependant tu pendant pieds quelques aux tête rien oui après terre alors leur ainsi ni être cet car quand quelque puis dit radeau axel 
por,de a e que o da os do em um as uma com não se por na dos no das para como á ao mais era sua é sem ella eu mas lhe nos ou elle já nas seu seus aos luiza toda pela num numa tudo dum grande tinha sobre casa me entre pelo quando olhos rogério então onde ás tão foi mesmo annos velho muito vida todos ia nem ainda noite suas duma meu tempo quem essa pouco cada disse minha tinham vez até mulher bem quasi estava ter depois dia cabeça mãos esse voz dois duas homem 
spa,de la que y el en a se los no un las su con del por era una lo había le más como al pero don para sus él es sin si ella todo vetusta o muy estaba ni aquella doña ya aquel ana tenía ser poco esta porque cuando magistral todos sobre podía eran siempre mucho menos ojos este habían entre bien señor yo tan vez hasta sí regenta después decía allí esto mesía casa otro anita nada dos sabía aquellos ozores así quería hombre algo qué tal mujer eso años iba antes mundo todas usted aunque pues también 
