austronesian,ang sa ng na ay at mga di ni isang si isáng nang may hindî kanyáng ko mo kung gerardo lang pa ka kanyang itó walâng iyán memò kundî walâ ba hindi walang lahát anó kápitang sapagkat kay siyay ha ó man elíng pô lahat iyón siya dapwat aking upang
germanic,og det i at en er paa var de han den der ikke til jeg af men saa med som for hun om et sig har havde da man ja jo nu sagde kan fra du hvad ogsaa ved berner kunde noget være ud skulde hvor ham dem duborg terndrup 
 die und das ein ist auf in so hat zachenhesselhans sich im mit sie wie zu ich einer noch an aber nicht nit einen aus auch über eine wenn von wir fei hanstonl vom denn sagt es jetzt daß schon was fanele haben sein sind the and of to a he that his it had you with as which my is have him be there on this me said upon but from we all they not no her were by one been them when are up would að og í á sem þú það með því eða eigi við þess um ekki eru þér konu ef þá fyrir henni svo eins þar eg hún vel verður sé getur þegar hefir sje sér úr þeim undir þarf áður þig heldur átt þær vera hafa van het te een dat door aan met op ook hij eene zijn uit niet zich bij als voor ik maar tot zij naar hem wij dit dan zijne hebben haar heeft magie t zooals ze wordt gij hadde av sa skal aksel ha igjen vilde nei hende bare kom barbro sier och att jag på så är för inte till ett honom hon david hade då hans där skulle när mig ej bara henne detta ni vad upp ut skall över vara
romance,de la à et le les je un en nous des du il que ne une mon pas dans se ce au me qui oncle plus mais sur par cette ces avec pour a son dun sa est ses bien si professeur sans tout comme hans dune peu ma mes 
 e — di che non in una con per è della del era i da più mi io sua come alla ella signora gli suo aveva al lo egli signor gegia ha o oh due ci nella così quando lei perchè de os do em um as uma com não por na dos no das para como á ao é sem eu mas lhe nos ou elle já nas seu seus aos luiza toda pela num numa tudo dum grande tinha cu ca pe din nu cand lui mai care prin ei cum tu el este te eminescu ea dar sunt cea tot iar dulce caci mea fi sau viata fata lume ta cel ochii lor luna y los las su había más pero don sus él es sin todo vetusta muy estaba ni aquella doña ya aquel ana tenía ser poco esta porque cuando
slavic,se a na to v do je slávek s že si k ale už co by i po za byl jako z tak když ho u bylo jak řekl o »a tam tu mu jen zase jeho jsem ještě jim ti až před ani ve od byla jsou tetička »to 
 się w nie jej że lecz już przez go pan sobie on pod teraz ona gdy ją tej jeszcze tylko przed dla oczy było ze bo nagle nawet jest tego janek ten wentzel był
uralic,ja hän on niin mutta ei minä oli hänen se että kun mitä kuin nyt sen ole hyvä minun teidän sinä en olisi vain sitten jos kuinka joka sitä te eikä kyllä tämä häntä olen jo minua sanoi vielä alkoi siinä kaikki siitä voi koko ylhäisyytenne tai mitään rouva kanssa 
 a – az s nem hogy és egy volt de csak is mint meg ki kis ez már ha el szólt azt még volna mikor én nagy aztán van vagy mert ő ember úgy nagyon mi egész mit minden igen szép ne mely lilith jó ezt szegény olyan
