austronesian,sa ug ang nga si mga ka na iyang dili ni kong akó mao minay ing lan sing aku ora dheweke saka wis kanggo ana iki bisa sampeyan wong kita le o i e ma se ia ai sa ou te ona mai a ng at ay y t di isang nang itó ito của tôi một và có trong đã không ông anh là được bạn người các
baltic,ir jis aš kad buvo mano kaip į jo savo tai yra bet su iš ar kai ne mane man ką jūs taip kuris labai nieko ten jam mes jį tiek per žmogus apie gali kas po jie un ir no es uz viņš tas bija par ka to kā viņa vai viņu nav mēs mani tur ja tā savu lai ko tu zachenhesselhans saka teica pēc pie tagad viņi
gaelic,y yn a i r yr o ar ei oedd ac n wedi mae ond am un fod fel mor wrth ffordd ni fy hyd an air na agus e bha s gu ann do mar so b cha tha robh de dh iad sin ach go sé bhí ag é aon h d ní ná le féin raibh gur sa san
germanic,die en van in n is op my wat sy og det han i at de var paa der und die den das dem er ist auf the and to a of he that his að í á sem þú það til te het een dat ikke hun jeg du och som på att med
romance,i de la a que el l un d una en il à et le je les o os e n as non é di che si in da se um uma cu ca din y los no las
slavic,a se v na to je by do si o co s že už slávek k ale jako bylo z po tak od ho u za ve ty když dnes byl jeho jen i řekl pavel jak bude się nie w a że janek już jej sobie bo tylko przez tadzio przed tam tego rzekł bez było rózia mi też ci nam ze będzie
turkic,bir ve bu için o ben daha ne ama çok da onun iyi benim zaman gibi değil sonra de ile onu ya şey kadar her bana vardı oldu beni tarafından geri var dedi nasıl eğer adam ki veya başka olduğunu olarak olacak iki şekilde biz ona onlar biraz olan neden sadece hakkında olduğu fazla içinde karşı diğer güzel bazı zaten en evet yüzden önce acı tüm birçok küçük kötü doğru diye hangi birkaç üzerine a
uralic,ja ta ma on see et oli kui ei mis seda oma tema sa minu mulle mind mu need selle nii pole kas kes kuid ja hän mutta minä hänen niin se teidän että mitä nyt tarkastaja ole ylhäisyytenne rouva sen en sanoi kuin olen hyvä kun a nem az s hogy és egy csak volt mint meg még de inicza el én ha ez kis szólt is már ki jó
vasconic,eta ez da zuen zen bat bere nire egin izan dut esan baina nuen edo hori nintzen ere ziren duzu gure nahi hau du dugu egiten gabe oso dago nion neska ari nahikoa den behar zer bi batean zure nola hitz hasi dira zituen egun diren hemen izango uste duen naiz gaur joan asko eman zara erantzun hain batzuk gizon galdetu luiza ezer zuten sartu artean gelak gehiago batzuetan bizitza beraz txarra eraman lau beti
